{
  "schemaVersion": "kaleidosphere/k4c-delivery-readback-receipt/v1",
  "generated_at": "2026-08-28T18:06:00.000Z",
  "task": {
    "id": "INT-KS76-DELIVERY-READBACK-02",
    "issue": "KS76"
  },
  "fixture": "tests/fixtures/release/k4c-delivery-readback-v1.json",
  "inputDigests": {
    "local": {
      "path": "verification/k4c/local-contract-integration-v1.json",
      "sha256": "84a413920d610c1dc0721eeb5d68485298f3313be3e19c8653b9fb4d765219ec",
      "schemaVersion": "kaleidosphere/k4c-local-contract-integration/v1",
      "provenance": "local-contract-integration",
      "task_id": "INT-KS76-DELIVERY-READBACK-02",
      "issue_id": "KS76",
      "freshness": {
        "issued_at": "2026-08-28T18:00:00.000Z",
        "expires_at": "2026-08-28T18:10:00.000Z",
        "nonce": "a19e07015ba016cf00fe5e64d5c25182223618e157b14126e69c523c8f3d9b18"
      },
      "observed_sha256": "84a413920d610c1dc0721eeb5d68485298f3313be3e19c8653b9fb4d765219ec"
    },
    "portal": {
      "path": "verification/k4c/portal-submission-receipt-v1.json",
      "sha256": "013fd90eb5a6aad8122953284e825cf47741f51526916fcb18b8726ea994e3fc",
      "schemaVersion": "kaleidosphere/k4c-portal-submission-receipt/v1",
      "provenance": "portal-preflight",
      "task_id": "INT-KS76-DELIVERY-READBACK-02",
      "issue_id": "KS76",
      "freshness": {
        "issued_at": "2026-08-28T18:00:00.000Z",
        "expires_at": "2026-08-28T18:10:00.000Z",
        "nonce": "b29e07015ba016cf00fe5e64d5c25182223618e157b14126e69c523c8f3d9b19"
      },
      "observed_sha256": "013fd90eb5a6aad8122953284e825cf47741f51526916fcb18b8726ea994e3fc"
    },
    "anonymous": {
      "path": "verification/k4c/anonymous-directory-readback-v1.json",
      "sha256": "90b85deef6961c0fe0845ed51843b5447133c4b98a668a58b5d3059e2e392b53",
      "schemaVersion": "kaleidosphere/k4c-anonymous-directory-readback/v1",
      "provenance": "anonymous-directory-readback",
      "task_id": "INT-KS76-DELIVERY-READBACK-02",
      "issue_id": "KS76",
      "freshness": {
        "issued_at": "2026-08-28T18:00:00.000Z",
        "expires_at": "2026-08-28T18:10:00.000Z",
        "nonce": "c39e07015ba016cf00fe5e64d5c25182223618e157b14126e69c523c8f3d9b20"
      },
      "observed_sha256": "90b85deef6961c0fe0845ed51843b5447133c4b98a668a58b5d3059e2e392b53"
    },
    "terminal": {
      "path": "verification/k4c/terminal-evidence-v1.json",
      "sha256": "d80cf57f869db6bffc833b7f53948a7bd1ba48c84ab92a635c2321199d38e0da",
      "schemaVersion": "kaleidosphere/k4c-terminal-evidence-receipt/v1",
      "provenance": "terminal-evidence-classifier",
      "task_id": "INT-KS76-DELIVERY-READBACK-02",
      "issue_id": "KS76",
      "freshness": {
        "issued_at": "2026-08-28T18:00:00.000Z",
        "expires_at": "2026-08-28T18:10:00.000Z",
        "nonce": "d49e07015ba016cf00fe5e64d5c25182223618e157b14126e69c523c8f3d9b21"
      },
      "observed_sha256": "d80cf57f869db6bffc833b7f53948a7bd1ba48c84ab92a635c2321199d38e0da"
    }
  },
  "bindingDigest": "dcade9b3cb5ec39b6d2ce968c7af0c5e80059be60cf3e1e13637d6c28d2551e2",
  "terminalDisposition": "RELEASED",
  "disposition": "RELEASED",
  "reason": "upstream terminal classifier is RELEASED and fresh anonymous discovery plus install prove the same digest",
  "evidence": [],
  "resumeActions": [],
  "rollback": "Delete the owned script, test, fixture, schema, and verification receipt; external rollback is unnecessary because execution is local and read-only.",
  "side_effects": [],
  "nonClaims": [
    "No delivery, submission, listing, external issue close, cache removal, public correction, or production readiness is performed or inferred.",
    "This receipt is a deterministic local readback of four committed receipts and creates no external state."
  ]
}
